{
  "schema_version": 1,
  "receipt_role": "Galois English R3 all-page visual QA",
  "reader_role": "GPT-annotated English reader",
  "exact_doi": "10.5281/zenodo.21935485",
  "concept_doi": "10.5281/zenodo.21924301",
  "pdf_sha256": "BC20BFF9ECFDB694F572F6738C0E120EC39BABE490F5FB5D7BD5EC9DF596335E",
  "page_count": 84,
  "inspected_pages": [
    1,
    2,
    3,
    4,
    5,
    6,
    7,
    8,
    9,
    10,
    11,
    12,
    13,
    14,
    15,
    16,
    17,
    18,
    19,
    20,
    21,
    22,
    23,
    24,
    25,
    26,
    27,
    28,
    29,
    30,
    31,
    32,
    33,
    34,
    35,
    36,
    37,
    38,
    39,
    40,
    41,
    42,
    43,
    44,
    45,
    46,
    47,
    48,
    49,
    50,
    51,
    52,
    53,
    54,
    55,
    56,
    57,
    58,
    59,
    60,
    61,
    62,
    63,
    64,
    65,
    66,
    67,
    68,
    69,
    70,
    71,
    72,
    73,
    74,
    75,
    76,
    77,
    78,
    79,
    80,
    81,
    82,
    83,
    84
  ],
  "all_pages_visually_inspected": true,
  "visual_result": "PASS",
  "blocking_findings": []
}
